Requêtes les plus fréquentes,Clics,Impressions,CTR,Position
ev tires,301,8322,3.62%,5.76
michelin ev tires,62,2185,2.84%,7.56
quietest ev tires,23,115,20%,1.57
ev tire,20,1456,1.37%,7.58
electric vehicle tires,16,2255,0.71%,10.88
ev snow tires,16,888,1.8%,4.94
electric car tires,13,1805,0.72%,12.66
michelin ev ready tires,13,38,34.21%,2.55
michelin ev ready,12,30,40%,2.7
best tires for hybrid cars,11,292,3.77%,3.98
ev truck tires,11,110,10%,5.9
winter tires for ev,11,57,19.3%,5.4
tires for electric cars,10,2529,0.4%,12.16
ev tire pressure,9,112,8.04%,3.79
ev specific tires,8,289,2.77%,7.91
electric vehicle tuned tires,8,111,7.21%,5.08
hl tires,8,72,11.11%,5.35
ev ready tires,8,42,19.05%,1.52
are electric cars quieter than gas cars,8,40,20%,2.08
best ev tires,7,862,0.81%,25.38
snow tires for ev,7,39,17.95%,2.18
ev winter tires,6,1084,0.55%,7.01
ev car tires,6,950,0.63%,8.17
michelin pilot sport ev,6,450,1.33%,29.75
michelin ev tyres,6,137,4.38%,9.34
tires for evs,6,80,7.5%,6.46
ev dedicated tires,6,48,12.5%,4.88
michelin electric vehicle tires,6,20,30%,2.55
tires for ev,5,894,0.56%,7.56
quiet ev tires,5,494,1.01%,2.68
what are ev tires,5,189,2.65%,10.56
michelin motion for life,5,79,6.33%,4.23
michelin tires for electric vehicles,5,32,15.62%,3.59
high load tires,5,30,16.67%,2.73
michelin tires for hybrid cars,5,28,17.86%,3.04
michelin ev tire,4,116,3.45%,6.22
winter tires for ev cars,4,40,10%,6.08
hl tire,4,26,15.38%,4.65
michelin electric car tires,3,1194,0.25%,11.15
best tires for ev,3,659,0.46%,21.85
best ev winter tires,3,550,0.55%,12.71
ev tire wear,3,219,1.37%,20.95
quietest michelin tires,3,199,1.51%,7.86
winter tires for electric cars,3,122,2.46%,4.56
hl tires meaning,3,81,3.7%,5.85
are electric cars quieter,3,76,3.95%,10.05
ev tire rotation,3,40,7.5%,1.43
ev winter tyres,3,33,9.09%,9.97
winter tires for evs,3,30,10%,4.37
ev tired,3,29,10.34%,4.24
ev tores,3,29,10.34%,4.97
best tires for hybrid suv,3,27,11.11%,2.33
electric vehicle winter tires,3,27,11.11%,10.78
how quiet are electric cars,3,24,12.5%,1.88
ev ready tires meaning,3,22,13.64%,3.05
best ev snow tires,3,20,15%,11.75
quietest ev tyres,3,17,17.65%,4.35
best ev tyres,3,12,25%,34.33
ev winter tire,3,9,33.33%,4.33
best ev tires 2024,3,8,37.5%,3.25
winter tire for ev,3,5,60%,1.4
high load capacity tires,3,5,60%,2.4
winterreifen elektroauto test,3,4,75%,2.5
tires for ev cars,2,2235,0.09%,9.43
tires for electric vehicles,2,1065,0.19%,8.08
electric vehicle tire,2,691,0.29%,7.04
electric tires,2,676,0.3%,6.95
quietest tires for tesla model 3,2,518,0.39%,5.48
do evs need special tires,2,157,1.27%,34.46
tires for hybrid cars,2,148,1.35%,10.84
winter tyres for electric cars,2,138,1.45%,19.27
hybrid car tires,2,67,2.99%,9.85
ev tuned tires,2,59,3.39%,5.85
quietest tires,2,48,4.17%,26.48
best tires for electric vehicles,2,47,4.26%,32.23
michelin tires for ev,2,44,4.55%,4.82
tires for ev vehicles,2,43,4.65%,7.49
quietest electric car,2,38,5.26%,10.34
michelin hybrid tires,2,34,5.88%,2.47
winter ev tires,2,29,6.9%,4.93
ev tire load rating,2,21,9.52%,3.76
ev ready tyres,2,20,10%,4.85
michelin defender 2 ev,2,20,10%,7.25
electric car tyre pressure,2,16,12.5%,6.25
quietest evs,2,13,15.38%,6
ev tyre pressure,2,12,16.67%,3.92
best tires for hybrids,2,11,18.18%,3.09
tire for electric car,2,9,22.22%,9.33
winter tires electric car,2,7,28.57%,6.86
michelin primacy ev tires,2,7,28.57%,7
ev rated winter tires,2,6,33.33%,7.67
best tires for electric cars,1,1180,0.08%,23.88
best winter tires for electric cars,1,957,0.1%,10.81
ev compatible tires,1,374,0.27%,20.33
michelin quiet tires,1,284,0.35%,11.67
motion for life,1,145,0.69%,7.27
electric car winter tires,1,134,0.75%,5.75
michelin tires for electric cars,1,119,0.84%,11.29
ev tires on gas car,1,114,0.88%,8.33
quietest ev,1,65,1.54%,6.78
michelin electric tires,1,65,1.54%,10.11
ev tyres,1,63,1.59%,64.17
what is an ev tire,1,53,1.89%,12
best winter tires for ev,1,50,2%,10.06
are electric cars silent,1,39,2.56%,2.46
michelin ev,1,33,3.03%,10.61
best tire for hybrid car,1,32,3.12%,5.56
ev range tires,1,25,4%,5.96
michelin tire noise ratings,1,21,4.76%,1.81
michelin tires ev,1,21,4.76%,3.05
which michelin tire is the quietest,1,20,5%,1.05
how much quieter are electric cars,1,20,5%,2.8
quietest tires for tesla model s,1,20,5%,3.15
best hybrid car tires,1,19,5.26%,3.74
michelin ev winter tires,1,19,5.26%,7.05
pneu voiture electrique,1,17,5.88%,4.59
michelin primacy ev,1,17,5.88%,8.82
how are ev tires different,1,17,5.88%,18
michellin ev tires,1,16,6.25%,4.25
do you need special winter tires for ev,1,15,6.67%,4.6
kona ev tires,1,15,6.67%,5
michelin ev tires all season,1,13,7.69%,6
michelin x ice ev,1,13,7.69%,7.62
can i use ev tires on a regular car,1,13,7.69%,13
ev specific tyres,1,13,7.69%,43.62
why are electric cars quieter,1,12,8.33%,2.75
do electric vehicles require special tires,1,12,8.33%,36.92
michelin noise cancelling tires,1,11,9.09%,6.91
best winter tyres for ev,1,11,9.09%,8.45
best snow tires for ev,1,10,10%,6.8
hybrid winter tires,1,10,10%,7.9
quietest tesla tires,1,9,11.11%,3.78
best winter tyres for electric cars,1,9,11.11%,9.22
michelin ev tires review,1,8,12.5%,1
oznaczenie opon vl hl,1,8,12.5%,2
new ev tires,1,8,12.5%,6
best tires for ev vehicles,1,8,12.5%,6.25
best tires for ev range,1,8,12.5%,11.25
michelin,1,8,12.5%,24.25
do electric cars need winter tires,1,7,14.29%,4
hl vs xl tires,1,7,14.29%,5.86
how to tell if a tire is ev rated,1,7,14.29%,6
best winter tire for ev,1,7,14.29%,8.71
winterreifen für elektroautos,1,6,16.67%,2
electric cars tires,1,6,16.67%,7.17
michelin scooter tires,1,6,16.67%,28.67
hl tire meaning,1,5,20%,3.4
hyundai kona electric tires,1,5,20%,5.6
electric cars noise pollution,1,4,25%,1.75
bruit voiture electrique,1,4,25%,2
michelin acoustic tires review,1,4,25%,2.25
hyundai kona ev tires,1,4,25%,2.75
what is the quietest car,1,3,33.33%,1
bandenspanning elektrische auto,1,3,33.33%,2
beste winterbanden elektrische auto,1,3,33.33%,2
faut-il des pneus spéciaux pour les voitures électriques,1,3,33.33%,2
michelin quiet tyres,1,3,33.33%,2
nissan leaf snow tires,1,3,33.33%,2
stille autobanden,1,3,33.33%,2
michelin ev banden,1,3,33.33%,2.33
winterreifen e auto,1,3,33.33%,2.33
winter tires for electric vehicles,1,3,33.33%,7.67
bolt ev tire pressure,1,2,50%,1
affordable cars with quiet cabins,1,2,50%,2
best tyres for ev cars,1,2,50%,2
bridgestone ev tires,1,2,50%,2
ev acoustic tire,1,2,50%,2
michelin acoustic technology,1,2,50%,2
michelin pilot sport 5 ev,1,2,50%,2
quiet cabin cars,1,2,50%,2
quietest cars interior noise,1,2,50%,2
winterbanden voor elektrische auto,1,2,50%,2
michelin x ice snow for ev,1,2,50%,3
best ev tyres 2024,1,2,50%,3.5
what makes ev tires different,1,2,50%,3.5
ev9 snow tires,1,2,50%,4
most soundproof car,1,2,50%,4
are evs quieter,1,1,100%,1
2018 mitsubishi outlander phev tire size,1,1,100%,2
acoustic tire,1,1,100%,2
are ev tires more expensive,1,1,100%,2
best all weather tires for ev,1,1,100%,2
best michelin tires for sedan,1,1,100%,2
bolt pattern mitsubishi outlander 2024,1,1,100%,2
bridgestone ecopia h/l 422 plus review,1,1,100%,2
car confections sound level readings,1,1,100%,2
e-auto winter oder ganzjahresreifen,1,1,100%,2
ev tyres uk,1,1,100%,2
ioniq 5 snow tires,1,1,100%,2
jakie opony do hybrydy,1,1,100%,2
mach e tire rotation,1,1,100%,2
michelin cross climate ev,1,1,100%,2
michelin crossclimate 2 review,1,1,100%,2
michelin crossclimate ev,1,1,100%,2
michelin primacy mxv4,1,1,100%,2
pneu hiver 208 électrique,1,1,100%,2
pneu le plus silencieux du marché,1,1,100%,2
pneus hiver pour voiture électrique,1,1,100%,2
prius 2008 tire size,1,1,100%,2
que mantenimiento lleva un coche electrico,1,1,100%,2
stilste autoband 2024,1,1,100%,2
tesla rotate tires,1,1,100%,2
tyres for ev,1,1,100%,2
tystaste sommardäcket 2024,1,1,100%,2
usure pneus voiture electrique,1,1,100%,2
wer darf beim e-auto reifenwechsel,1,1,100%,2
ev banden onder gewone auto,1,1,100%,3
how to drive ev in snow,1,1,100%,3
michelin hl,1,1,100%,3
michelin primacy 4 vs continental premiumcontact 6,1,1,100%,3
stilste elektrische auto,1,1,100%,3
the quietest cars,1,1,100%,3
id4 snow tires,1,1,100%,4
michelin noise reduction tires,1,1,100%,4
michelin solar car tires,1,1,100%,4
ev tyre comparison,1,1,100%,5
michelin crossclimate 2,1,1,100%,6
pilot sport ev vs pilot sport 4s,1,1,100%,11
best winter tires for electric suv,1,1,100%,13
tire wear on electric vehicles,1,1,100%,23
electric vehicle,1,1,100%,196
do electric cars need special tires,0,1336,0%,36.6
electric car tire,0,939,0%,7.46
do electric cars wear out tires faster,0,772,0%,40.97
best tires for ev cars,0,767,0%,26.62
e.v. tire,0,698,0%,7.25
ev cars tires,0,631,0%,11.51
e.v. tires,0,624,0%,7.69
electric tire,0,572,0%,11.7
do electric cars have spare tires,0,502,0%,45.21
quiet tires for electric vehicles,0,416,0%,8.23
best plug in hybrid,0,380,0%,47.29
how to choose the right tires for electric cars?,0,355,0%,11.91
what does ev compatible tires mean,0,350,0%,13.52
how long do electric vehicle tires last?,0,321,0%,43.53
best electric vehicle tires,0,314,0%,20.85
do electric cars wear out tyres faster?,0,307,0%,60.57
ev range,0,303,0%,83.37
do electric cars make noise,0,292,0%,8.22
what is ev compatible tire,0,285,0%,15.19
best low rolling resistance tires for electric cars,0,272,0%,37.59
best phev,0,261,0%,49.39
what are the best tires for electric suvs?,0,220,0%,17.12
why do electric cars make noise,0,201,0%,9.61
suv electric vehicle tires,0,176,0%,7.41
do electric cars make a noise,0,149,0%,26.46
what are ev compatible tires,0,124,0%,12.19
plug in hybrid,0,124,0%,87.73
electric cars vs gas cars,0,121,0%,92.74
can you put ev tires on a regular car,0,119,0%,34.1
ev compatible tires meaning,0,118,0%,17.19
do electric cars use special tires,0,105,0%,34.71
winter ev traction advantage,0,96,0%,9.09
ev tires vs regular tires,0,95,0%,46.84
electric vehicle tires market,0,94,0%,77.61
ev warranty,0,87,0%,95.16
ev cars and tires,0,84,0%,16.17
are electric cars safer than gas cars,0,82,0%,77.82
do electric cars need special tyres,0,79,0%,64.2
are electric cars better than gas cars,0,78,0%,61.13
plug in hybrid maintenance,0,78,0%,74.83
electric car tyres,0,78,0%,79.88
special tires for electric cars,0,77,0%,32.35
michelin energy saver tires,0,77,0%,61.14
electric cars quieter,0,76,0%,22.93
are ev tires different,0,76,0%,24.5
tire wear on electric cars,0,75,0%,31.07
extra load tires for suvs,0,74,0%,9.18
electric cars quiet,0,74,0%,31.66
electric vehicle tyres,0,73,0%,63.37
plug in hybrid cars,0,73,0%,78.52
why are electric cars so quiet,0,72,0%,19.38
electric cars tire wear,0,71,0%,32.86
ev tires wear faster,0,70,0%,31.47
do electric cars need different tires,0,70,0%,37.11
michelin energy tires,0,70,0%,68
do electric cars go through tires faster,0,69,0%,36.09
how long do tires last on electric cars,0,69,0%,42.77
electric vehicle tires in europe,0,69,0%,84.57
are tires for electric cars different,0,68,0%,49.74
electric car tire wear,0,66,0%,34.71
do electric cars require special tires,0,66,0%,39.02
what is an ev compatible tire,0,65,0%,14.14
car tyres for electric vehicles,0,64,0%,4.05
best electric car tires,0,62,0%,36.66
electric vehicle tire wear,0,61,0%,34.51
do ev cars need special tires,0,60,0%,34.93
do tires wear out faster on electric cars,0,59,0%,42.97
www.michelinman,0,58,0%,6.88
how long do ev tires last,0,58,0%,38.83
why electric cars are better than gas cars,0,57,0%,45.3
ev specific tires market,0,57,0%,69.77
tire wear electric cars,0,56,0%,25.91
michelin suv tire,0,53,0%,38.96
best tires for a hybrid car,0,52,0%,5.77
do electric cars use tires faster,0,52,0%,35.87
do you need special tires for electric cars,0,52,0%,37.65
what is ev compatible tires,0,49,0%,8.61
tires kona,0,49,0%,51.1
why are electric cars better than gas cars,0,49,0%,52.76
do electric car tires wear out faster,0,48,0%,44.48
do electric cars use different tires,0,48,0%,46.62
tires on electric cars,0,47,0%,24.06
plug in hybrids,0,46,0%,85.91
michelin tesla tires,0,45,0%,35.18
do electric cars wear tires faster,0,44,0%,35.84
hybrid tires for cars,0,43,0%,7.56
electric car tires vs regular tires,0,43,0%,48.88
best plug-in hybrid,0,42,0%,45.76
ev tire care,0,41,0%,3.05
are electric car tires different,0,41,0%,35.8
tesla tire rotation,0,40,0%,2.48
are electric cars quiet,0,39,0%,9.23
tyres for electric cars,0,39,0%,50.38
electric vehicle range,0,39,0%,86.08
electric vehicle tyre market,0,39,0%,99.26
optimize ev,0,38,0%,7.87
do ev cars wear tires faster,0,38,0%,38.21
most efficient ev tires,0,37,0%,10.65
best winter tires for ev cars,0,37,0%,18.73
quiet tires for city driving,0,37,0%,23.92
tyres for electric vehicle market,0,36,0%,47.17
electric vehicle specific tires market,0,36,0%,76.67
best tire for electric car,0,35,0%,33.86
what does electric vehicle tuned mean for tires,0,34,0%,2.18
h/l tires meaning,0,34,0%,7.15
quiet michelin tires,0,33,0%,9.67
electric vehicle noise testing,0,33,0%,51.15
improving electric vehicles tyres,0,33,0%,63.94
tire wear on ev cars,0,32,0%,29.72
ev car tire wear,0,32,0%,34.47
reduce wear,0,31,0%,74.03
hyundai kona electric tyres,0,30,0%,30.43
electric vehicles in winter,0,30,0%,78.8
kona electric,0,30,0%,81.23
ev tire replacement,0,29,0%,14.48
quiet and smooth ev ride,0,28,0%,2.14
electric car tire problem,0,28,0%,38.96
do ev cars have spare tires,0,28,0%,47.71
are electric cars faster than gas cars,0,28,0%,67.68
quiet truck tires,0,27,0%,40.89
ev and hybrid tires market,0,27,0%,65.56
tires on electric vehicles,0,26,0%,20.12
electric car sound,0,25,0%,59.64
maintaining right tire pressure,0,25,0%,61.8
the purpose of a noise-reducing tire on an ev is to ________.,0,23,0%,5.87
what does hl mean on tires,0,23,0%,6.52
electric motorcycle tire market,0,23,0%,48.52
best plugin hybrid,0,23,0%,49.65
electric car noise,0,22,0%,9.68
apa yang dimaksud dengan “range anxiety” pada sepeda motor listrik?,0,22,0%,11.36
quietest car tires,0,22,0%,31.64
hybrid cars in winter,0,22,0%,86.55
quietest michelin tire,0,21,0%,1.81
why are electric cars quiet,0,21,0%,5
buy michelin tires,0,21,0%,78.14
michelin quietest tire,0,20,0%,2.3
best handling hybrid,0,20,0%,33.5
family tyres,0,20,0%,35.9
electric cars in the snow,0,20,0%,71.7
phev cars,0,20,0%,72.25
quietest cars under 30k,0,19,0%,1.21
do electric cars make noise when driving,0,19,0%,7
best tyres for hybrid cars,0,19,0%,7.16
how are electric cars better than gas cars,0,19,0%,51.21
micheline winter,0,18,0%,1
michelin quietest tires,0,18,0%,3.83
do electric cars have a spare tire,0,18,0%,51.72
ev maintenance,0,18,0%,95.22
weather ev,0,17,0%,3.71
high load capacity,0,17,0%,4.76
electric vehicle noise,0,17,0%,21.88
high load tire market,0,17,0%,28.12
best suv hybrid,0,17,0%,39.29
hyundai kona tires,0,17,0%,40.18
studless car tire market,0,17,0%,83.94
electric vehicle tuned,0,16,0%,2.75
best tires for hybrid,0,16,0%,3.5
heavy load tires,0,16,0%,3.5
best electric car tire,0,16,0%,21.12
ev rated tires,0,16,0%,26.44
ev winter tires canada,0,16,0%,30.44
electric vehicle sound,0,16,0%,48.44
michelin energy,0,16,0%,68
how long do tyres last on electric cars,0,16,0%,71.06
how are electric cars safer than gas cars,0,16,0%,85.88
what is the quietest michelin tire,0,15,0%,1
what is ev tires,0,15,0%,4.33
michelin tires quietest,0,15,0%,6.13
what does h/l mean on tires,0,15,0%,6.13
quietest tires for tesla model y,0,15,0%,8.2
can you use a tire with a higher load index,0,15,0%,32.47
electric cars versus gas cars,0,15,0%,92.67
best quiet tires for tesla model 3,0,14,0%,5.29
winter tyre for electric,0,14,0%,22.14
all weather ev tires,0,14,0%,24.14
kona electric tyres,0,14,0%,36.71
are electric cars heavier than gas powered cars,0,14,0%,52.79
do electric cars have special tyres,0,14,0%,72.79
motion for life michelin,0,13,0%,4
what does hl mean on a tire,0,13,0%,5.31
best suv hybrids,0,13,0%,33.46
do electric vehicles need special tires,0,13,0%,37.23
automobile noise,0,13,0%,54.54
quietest truck tires,0,13,0%,67.85
electric car tyre dimensions,0,13,0%,69.69
electric car tyres difference,0,13,0%,78.62
are electric cars better than gas,0,13,0%,79.46
quietest cars,0,12,0%,1.83
carl nadeau,0,12,0%,4.25
quietest michelin tires for suv,0,12,0%,4.5
michelin electric cars,0,12,0%,5.92
www michelinman com register tires,0,12,0%,8.08
best all-season tires for electric cars,0,12,0%,33.25
quietest hybrid suv,0,12,0%,46.75
are electric cars good in snow,0,12,0%,59.42
electric car in winter,0,12,0%,87.25
how often to rotate ev tires,0,11,0%,2
ev tires michelin,0,11,0%,3.55
michelin car tires,0,11,0%,27.82
choosing tyres for electric cars,0,11,0%,55
hybrid tire,0,11,0%,57.45
phev vehicles,0,11,0%,77.27
tesla weight vs regular car,0,11,0%,81.73
are electric vehicles quieter,0,10,0%,2
winter tires ev,0,10,0%,4.4
quiet tires for tesla model 3,0,10,0%,6.5
ev-ready tyres,0,10,0%,6.7
why do electric cars whine,0,10,0%,8.4
why do electric vehicles make noise,0,10,0%,9.4
ev noise,0,10,0%,13.5
best ev for snow,0,10,0%,15
michelin - pilot sport ev,0,10,0%,17.7
best ev tires for range,0,10,0%,18
electric scooter tires near me,0,10,0%,19.2
quiet tires,0,10,0%,29
best tyres for electric cars,0,10,0%,55.1
ev ranges,0,10,0%,75.8
electric vehicles by range,0,10,0%,82
can electric cars get wet,0,10,0%,86.2
winterbanden elektrische auto,0,9,0%,2
tire for ev car,0,9,0%,7
most quiet electric car,0,9,0%,10
what does ev compatible mean for tires,0,9,0%,10.56
why do evs need special tires,0,9,0%,21.67
ev compatible winter tires,0,9,0%,23.78
ev tires canada,0,9,0%,46.56
sounds for electric cars,0,9,0%,61.44
electric car tyre,0,9,0%,79.67
electric or gas car,0,9,0%,81.89
weight of electric cars vs gasoline,0,9,0%,82.11
higher load rating tires,0,8,0%,1
tires for heavy loads,0,8,0%,1.62
winterreifen elektroauto,0,8,0%,2
tires for electric vehicle,0,8,0%,7.12
ev specific winter tires,0,8,0%,7.88
what are ev rated tires,0,8,0%,7.88
quiet electric cars,0,8,0%,9.25
pilot sport ev,0,8,0%,25.75
best ev all season tires,0,8,0%,35.88
evs faq,0,8,0%,37
do ev tires wear faster,0,8,0%,37.5
hyundai kona electric tyre size,0,8,0%,41.38
is electric cars better than gas cars,0,8,0%,66.25
plug-in hybrid,0,8,0%,88.75
michelin energy e-v tyres,0,8,0%,93.38
michelin winter truck tires,0,8,0%,93.38
electric cars by range,0,8,0%,93.5
life tires,0,8,0%,95.5
what is the quietest and smoothest riding car,0,7,0%,1
quiet cars,0,7,0%,1.14
"tires designed for use on hybrid or electric vehicles operate at higher 
inflation level and are known as",0,7,0%,7.43
"how do electric vehicles help in reducing noise pollution? * 1 point by 
making loud engine noises by using quieter tires by not using an engine at 
all by installing soundproof windows",0,7,0%,7.71
do you need ev tires,0,7,0%,20.86
best winter tires for evs,0,7,0%,30.71
michelin technology,0,7,0%,32
tyres for electric vehicles,0,7,0%,47.29
hybrid tires,0,7,0%,52.14
ev tyre,0,7,0%,66.86
why are electric cars better than gasoline cars,0,7,0%,66.86
tire pollution from electric cars,0,7,0%,84.57
do electric cars have to make noise,0,6,0%,7.5
tires electric vehicles,0,6,0%,8.17
what is an ev rated tire,0,6,0%,8.83
why are electric cars so loud,0,6,0%,9.83
what makes a tire ev compatible,0,6,0%,12.67
do hybrid cars need special tires,0,6,0%,13.17
michelin electric vehicle tyres,0,6,0%,14.67
best all weather ev tires,0,6,0%,22
best tyres for ev,0,6,0%,26.17
best all season ev tires,0,6,0%,26.5
ev compatible,0,6,0%,27.17
quiet winter tires,0,6,0%,33.17
plug in hybrid motorcycle,0,6,0%,43.33
michelin energy e-v,0,6,0%,45
best plug-in hybrids,0,6,0%,46.33
specials on michelin tires,0,6,0%,50.17
electric car snow,0,6,0%,51.83
best phev vehicles,0,6,0%,52.67
electric cars better than gas cars,0,6,0%,57.5
suv michelin tires,0,6,0%,57.5
are evs heavier than gas cars,0,6,0%,62.33
michelin tire rebate 2017,0,6,0%,63.5
why electric cars are better than gas,0,6,0%,66.5
why you need ev tyres,0,6,0%,67.5
plug in hybrid vehicles,0,6,0%,88.5
gas auto,0,6,0%,99
michelin rv tire,0,6,0%,101.5
automotive winter tires market,0,6,0%,155
quietest car,0,5,0%,1.6
michelin primacy,0,5,0%,2
"kendaraan listrik lebih senyap alias tidak berisik daripada kendaraan 
konvensional, sehingga diperlukan tambahan suara palsu supaya aman",0,5,0%,4.4
best tires for kona ev,0,5,0%,5.2
michelin ev tyre,0,5,0%,6.4
tire ev,0,5,0%,6.4
ev tire ratings,0,5,0%,8.6
"qietest tires for model 3 18""",0,5,0%,8.6
the a vehicle the more energy of motion it develops,0,5,0%,12.2
ev road noise,0,5,0%,16.6
best hybrid tires,0,5,0%,24
quiet ride tires,0,5,0%,27.4
michelin passenger car tires,0,5,0%,36
best hybrid bicycle tires,0,5,0%,48.4
best plug-in hybrid cars,0,5,0%,49.2
ev tires cost,0,5,0%,65.2
electric vehicle innovations,0,5,0%,74
gas cars vs electric cars,0,5,0%,91.6
why are gas cars better than electric cars,0,5,0%,92.8
energy saver tires,0,5,0%,96.2
michellin,0,4,0%,1
pression pneu voiture electrique,0,4,0%,2
michelin primacy tour a/s,0,4,0%,3
tire rotation ev,0,4,0%,3
michelin tires,0,4,0%,3.5
michelin tyre for ev car,0,4,0%,4.75
best tire for ev,0,4,0%,5.75
do electric cars make a sound,0,4,0%,7
what is different about ev tires,0,4,0%,7.25
electric cars noise,0,4,0%,7.5
reifen für elektroautos,0,4,0%,7.5
do electric cars have to make a noise,0,4,0%,7.75
glowing tires michelin,0,4,0%,8.75
michelin defender 2,0,4,0%,8.75
quietest electric cars,0,4,0%,8.75
https www michelinman com register tires,0,4,0%,9.25
what makes tires ev compatible,0,4,0%,9.75
best ev truck tires,0,4,0%,10
do i need ev tires,0,4,0%,11.25
winter tyres for ev,0,4,0%,12.5
ev tires near me,0,4,0%,13.25
quietest tires 2024,0,4,0%,16.75
higher load,0,4,0%,21.5
all season ev tires,0,4,0%,25.75
quietest passenger car tires,0,4,0%,28.25
why are electric cars better than gas,0,4,0%,28.75
winter tires for hybrid cars,0,4,0%,30.5
michelin tires for trucks,0,4,0%,32.5
the best plug in hybrid,0,4,0%,44
electric car tires difference,0,4,0%,44.25
quietest at tire,0,4,0%,45.25
best plug in hybrids,0,4,0%,48.5
what is a quiet tire,0,4,0%,50.25
top plug in hybrid,0,4,0%,54.5
tips for driving ev in winter,0,4,0%,55
are electric cars heavier than gas cars,0,4,0%,56
do you need special tyres for electric cars,0,4,0%,56.5
michelin tires suv,0,4,0%,57.5
michelin pilot sport ev tyres,0,4,0%,63.25
ev winter,0,4,0%,64.5
ev1 electric car,0,4,0%,66
electric car tire pollution,0,4,0%,66.25
ev innovations,0,4,0%,66.5
ev load,0,4,0%,67
why gas is better than electric cars,0,4,0%,69.25
michelin e primacy,0,4,0%,71.25
what are evs,0,4,0%,72
noise reduction for electric vehicles,0,4,0%,76
plug in hybrid car,0,4,0%,76.75
ev impact,0,4,0%,78
electric cars vs gas cars performance,0,4,0%,79.75
is a plug-in hybrid right for me,0,4,0%,80.75
when are electric cars compulsory,0,4,0%,80.75
understanding electric cars,0,4,0%,81.5
ev car tyres,0,4,0%,82.25
electric cars in winter,0,4,0%,84.5
electric car tire emissions,0,4,0%,85.5
are electric vehicles heavier,0,4,0%,85.75
are electric cars faster than gasoline cars,0,4,0%,87.25
are electric cars faster than gas,0,4,0%,93
electric bike engine noise,0,4,0%,95
electric cars vs. gas cars,0,4,0%,96.25
electric car vs gas car,0,4,0%,97
are michelin tires quiet,0,3,0%,1
best car for road noise,0,3,0%,1
do electric cars make sound,0,3,0%,1
quiet driving,0,3,0%,1
bridgestone ecopia h/l 422 plus,0,3,0%,2
michelin defender 2 review,0,3,0%,2
michelin primacy a/s,0,3,0%,2
stilste autobanden,0,3,0%,2
tiago ev tyre pressure,0,3,0%,2
best tyre for ev,0,3,0%,2.33
tire rotation tesla,0,3,0%,2.33
cabin noise ratings cars 2024 australia,0,3,0%,4.67
are electric cars noisy,0,3,0%,5
michelin e bike tires,0,3,0%,5.33
tesla quiet tires,0,3,0%,5.67
best winter ev tires,0,3,0%,6.33
are electric cars quieter than petrol cars,0,3,0%,7
pneu michelin voiture électrique,0,3,0%,7
tyres for hybrid cars,0,3,0%,8.33
high tire,0,3,0%,9.67
slogan michelin 2024,0,3,0%,10
michelin x-ice snow,0,3,0%,11
why do ev need special tires,0,3,0%,11.67
quiet car tires,0,3,0%,24.33
michelin pilot ev,0,3,0%,27.67
tesla michelin tires,0,3,0%,31.33
quietest passenger care tires,0,3,0%,36.33
ev tires for tesla,0,3,0%,36.67
kona ev wheels,0,3,0%,39.67
technology michelin,0,3,0%,43.67
best tires for hybrid bikes,0,3,0%,54.67
best plug in car,0,3,0%,56.67
electric cars in snow,0,3,0%,60
advantages of winter tires,0,3,0%,77.33
michelin tire rebate,0,3,0%,78.67
are electric,0,3,0%,85.33
tesla tires foam,0,3,0%,91
phev car,0,3,0%,100.67
are electric cars loud,0,2,0%,1
car tyres for heavy load vehicles,0,2,0%,1
cars with low road noise,0,2,0%,1
do evs require special tires,0,2,0%,1
high load rating tires,0,2,0%,1
how much does tesla charge to rotate tires,0,2,0%,1
hummer ev tire pressure,0,2,0%,1
michelin sound,0,2,0%,1
quiet luxury cars,0,2,0%,1
quiet small cars,0,2,0%,1
silent car,0,2,0%,1
silent car in india,0,2,0%,1
the most quiet car,0,2,0%,1
tire noise rating chart michelin,0,2,0%,1
98y tire meaning,0,2,0%,1.5
h and l tire,0,2,0%,1.5
michelin energy ev,0,2,0%,1.5
quietest cars under 10k,0,2,0%,1.5
which car has the quietest cabin,0,2,0%,1.5
autobanden elektrische auto,0,2,0%,2
best tires to reduce road noise,0,2,0%,2
do ev need special tyres,0,2,0%,2
ev tyres vs normal tyres,0,2,0%,2
evs are dangerously quiet,0,2,0%,2
gilt lärmschutz für elektroautos,0,2,0%,2
michelin primacy 5,0,2,0%,2
model x snow tires,0,2,0%,2
most silent car,0,2,0%,2
pneu michelin tourisme all1 avis,0,2,0%,2
quietest suv uk,0,2,0%,2
tyres for ev cars,0,2,0%,2
winterreifen für e auto,0,2,0%,2
winterreifen für e autos,0,2,0%,2
самые тихие летние шины,0,2,0%,2
bridgestone dueler hl 275/55r20,0,2,0%,2.5
bridgestone ecopia h/l 001,0,2,0%,2.5
ioniq 5 tire pressure,0,2,0%,2.5
quietest suv,0,2,0%,2.5
low road noise cars,0,2,0%,3
silence car electric,0,2,0%,4
"""tesla tire road noise""",0,2,0%,4.5
do electric cars need special winter tires,0,2,0%,4.5
do electric vehicles make noise,0,2,0%,4.5
"""tire road noise"" ""tesla""",0,2,0%,5
michelin tires winter,0,2,0%,5
